萬華艋舺大道旁有一小片草地，旁邊還有幾棵大榕樹，草地後方還有一棟紅磚平房建築，跟周圍的車水馬龍及現代化建築形成強烈對比。每天上班都會路過此地，一直感到很好奇，今天趁著假日特地前來一探究竟~草地一旁立有石敢當，不少附近的老人在樹下納涼、聊天喝茶。草地旁現在立了一個兒童遊戲區，老人聊天、小孩可以在一旁玩耍也不會無聊。即使是這樣炎熱的夏天，在大樹下還是有徐徐涼風，天然的冷氣好舒服~牆上嵌有建築歷史說明，原來這建築物以前是療養院，可追溯至清朝、日治時期，在昔日大家對於精神病患認識不多的環境下，還能建立這樣一座療養院，真是不容易。紅磚牆上的木窗，玻璃後方有鐵欄杆療養院早已搬遷，現在規劃為綠化教室。門旁貼了張課程表，課程還挺豐富的，住在附近的居民沒事可以來上上課還不錯…進門後右側，主要是展示一些跟療養院相關的歷史文件副本還有建物模型，原本的療養院更具規模，但目前只留下現在看到的這一棟建築—第一病房。原來前方的2棵大榕樹也是台北市列為保護的古樹，從日治時期起就有相關的紀錄資料。牆上還掛了不少的歷史照片，照顧病患的技士病患住院生活情形另一邊的空間，現在規劃為閱覽室以及上課用途。放在書架上的草編作品後方規劃為和平青草園，種植了許多食用植物到手香，具有消炎效果迷迭香，吃西餐經常看的到這種香料炎熱的夏天最適合吃仙草退火了，原來仙草長這樣阿~走在小巧的青草園中，可以聞到芬芳的青草味，很舒服。萬華可以說是台北的發源地，目前還保有許多具有可看性的建築，十分適合在假日來個歷史建築之旅~,"['歷史','自然','親子']"
追思故人的真人實境屋幽靜巷弄裡，綠屋襯著青翠樹姿靜佇在時光流影之中，這棟1935年興建的日式宿舍，是日治時期台灣總督府交通局遞信部歷任部長官舍，素有「台灣科技之父」美稱的李國鼎先生於1972年接任財政部長時入住，一住三十年，2002年被列為市定古蹟。屋舍狀況保持良好，屋內擺設完全保持當年現況，門口的玄關，依然掛著三頂李國鼎先生的帽子，引進綠意的書房，擺放著先生的公事包，故人故居，歷歷在目，引人緬懷。庭園寬闊、老樹相伴，掩映綠意中的日式官舍，別有一番復古味道，值得細細觀遊領略。營業時間：10：00∼16：00公休日：週日與週一刷卡：不可展覽門票：全票50元、優待票25元※參觀需由專人引導，每日僅開放五場，導覽時間為10：30、11：30、12：30、13：30、14：30、15：30,"['展覽','歷史','異國']"
"2018年台北燈節於2月24日在台北市北門、中華路一段熱鬧登場，將於3月4日圓滿落幕。主燈由三隻台灣犬牽手圍繞而成，表徵世代融合，團結一致。金狗背部以海洋圖案，象徵領航台灣，努力向前。銀狗背部以四方圖案，象徵有容乃大。紅狗背部原住民圖騰，象徵冶原民文化與不同族群文化為一爐。【藝青閣】台北西門町傳統習俗與流行文化是一。【重生善性】將資源回收物轉化成藝術品，令人刮目相看。【風華登龍街】千盞燈籠喚起昔日台北風華曾有的記憶。【聖火台】承恩城門與新光摩天，傳統光榮與現代再顯。【浪浪彩繪燈】原來藝術也可以走入日常生活中。【重回提燈光陰】紙雕刻樺庶民生活入微。【守城巨人】守城巨人:陳化成將軍。獲得台北好水標章，打開水龍頭即可生飲。幸福GOGO!上海旅遊節吉祥物樂樂向遊客揮手致意。台灣犬身影燈環繞承恩門，追趕跑跳，十分吸睛。煙硝巨砲，捍衛海防。陳化成將軍奮戰海盜，守護台北。幸福GOGO!風車、木鞋、鬱金香是荷蘭給人們的印象。樂遊韓國大邱市。松山市湯是日本三大古湯之一。聖克里斯多福及尼維斯的歷史防禦建築，名列世界文化遺產。台北城隍廟燈如晝。祈福生子燈，反映""鑽燈腳做阿爸""習俗。燈上紙雕刻畫日治台灣時期庶民生活。西門城牆雖不見，但意象仍在。東京有櫻花，台北也有杜鵑花。深受動漫迷喜愛的皮卡丘，萌樣吸引遊客注目。每30分鐘展演一次燈光秀，絢麗奪目。台北燈節，遊人成市。摩肩接踵，寸步難行。","['藝術','親子']"
"2019台北燈節以""夢想""和""心""為主題。現代科技與傳統花燈融合，共創一個嶄新的快樂節慶。2月16日搭捷運到西門站，剛出站百變豬寶迎面而來，眼睛為之一亮。心花怒放將親手書寫的小卡片掛在心型的祈福燈座上，希望豬年豬事順利。塗鴉帳篷立基地，創新作品展空間。常見水塔也可成為塗鴉藝術作品畫布，真是意外!吉他豬寶夢裡呢喃:我愛音樂!台北市萬福國小與萬盛庄社區合作，製作35公尺長的故事牆，說500個社區故事。旋轉故事燈敘述著昔日社區的故事。剪紙創作呈現社區年節共同的記憶。與熊讚悠遊台北。婀娜多豬花燈展示遊客多穿越台北天后宮燈籠長廊，祈求國泰民安風調雨順。百變天后，守護幸福。靜待點燈夜漫漫!攝影機現場錄影直播，電視牆立即實況報導，引起觀眾一陣陣揮手雀躍。百變豬寶閉目鼾聲大作，觀眾千呼萬喚:醒來!醒來!豬寶驚醒，一陣錯愕!豬寶開始變換，豬寶前方百寶箱開啟，意外出現一位美女。美女向大家揮手致意，樂壞觀眾!頃刻間，豬寶化身機械獸，露出誇張的朝天鼻，潔白的牙齒。頃刻間，豬寶戴上舞獅面具，觀眾齊舉手機拍照，不亦樂乎!搖擺北門!日本松山市""撞轎""祭典，呈現日本文化底蔭。台灣省城隍廟花燈。",['藝術']
文化部在2009年委請臺北市政府文化局修繕齊東街日式宿舍（濟南路二段25、27號）完成之後，將此素雅的歷史建築命名為「齊東詩舍」，並打造成一個文學地景亮點。2014年7月，國立臺灣文學館開始營運管理並策畫展覽及文學推廣活動。地址：台北市濟南路二段25、27號（近金山南路）開放時間：每週二至週日10:00~17:00（週一休館）免費參觀齊東詩社面向濟南路二段，近金山南路，建築外圍有一排詩牆。濟南路二段25號入口25號建築保留了更多原來日式宿舍的風貌，修復後作為展覽空間。齊東街日式住宅區在日本時期稱為幸町職務官舍群，約建於1920年代至1940年代。此區為總督府所屬單位不同階級職務官舍的分佈區，濟南路二段一帶為總督府及軍方重要高等職務官舍，齊東街一帶建築群發展較晚，為低階官署機構職員官舍。戰後，國民政府亦將此區沿用為中央政府官員之宿舍群，其中濟南路二段27號在1949年由當時空軍副總司令王叔銘少將入遷，王將軍遷入後依序任職「中將副總司令」、「空軍上將總司令」、「國防部參謀總長」、「總統府戰略顧問委員會副主任委員」，直到1992年才遷出官邸。展覽室長廊詩社定位在推動詩的復興計畫，推廣詩的創作交流，特展正展出「屏東現代詩展」高掛著的詩句，讀起來覺得生動活潑有趣。對詩詞有興趣的人可常來詩社走動待在典雅的日式建築中看窗景也有一種小確幸，有感受濃濃的人文氣息。玻璃窗上的詩情畫意後院25號建築被綠意包圍著25號與27號隔著小通道27號入口要從小通道進入門牌27號入口反而成為偏門27號房舍作為活動空間，有「為兒童說故事」活動：每個月的第二個週日、第四個週六早上10:00~11:30，在日式老房子，配著和風徐徐，聽故事志工們說故事。培養對文學的喜好，耳濡目染從小紮根。活動室原為「座敷」，下挖成為開放式活動空間，可作為聽演講、說故事、看表演的場地。25號和27號原來建築的空間格局差不多，修復時27號建築格局變動較多，除了座敷下挖成為開放式活動空間，也刻意打開天花板。看見天花板展示木構造的形式與修復新舊材料的結合入口旁多用途空間多功能展間後院青草地齊東詩社25號建築是展覽空間，27號建築是活動空間。目前開放的齊東街日式宿舍群有台北琴道?、台北書畫院、齊東詩社可安排一日文青。,"['展覽','異國','藝術','親子']"
"幸町日式宿舍為日據末期的日式住宅，台北市文化局於2007年5月30日公告為台北市定歷史建築物。歷經「老房子文化運動」修復計畫，成為最美麗的公益圖書館~文房。想進入文房必須在網路預約→官網http://www.chapter.com.tw/#chapter1免費參觀文房位於臨沂街27巷1號，從外面看是高級住宅區，路過沒有留意門口指示牌的話，很難連結門內有一棟典雅的日式建築。網路預約每天有三梯次10:00、13:00、15:00(週一休)，請依約前往。預約限本人入館(須年滿12歲)，請出示相關證件核對。保護檜木地板，務必穿襪才能入館。集合在文房入口處，工作人員核對相關證件後採團進團出進屋。入口露臺、門廳為洋式建築，仿萊特風格。地板馬賽克磁磚混搭在日式建築中，很特別。屋子有滿滿的檜木香~聽導覽解說，參觀整個建築，約10分鐘後，就可以找個喜歡的座位看書閱讀了，閱讀時間約70分鐘，最後有茶點招待。簡單而用心的擺設，舒心~地板出現兩個色塊，是新舊木材的差別。修舊如舊的修復原則，保存堪用的原建材，不足部分加入新建材，原貌修復。天花板的橫木條紋是呼應地板的花樣，可見原建築對細部工程的用心。空間設計後已經看不出原來的格局，這間最大的閱讀區檜木香氣更濃，文房藏書4000冊，來自書本募集與自購。整修後，刻意打開天花板，讓大家看到木結構。導覽說這間檜木香是從屋頂木頭飄散下來的，因沒有在木頭表面塗上一層保護漆，所以味道更濃。屬於日式房舍建築中，象徵一家之主的支柱(黑柱)，有保留下來，但大部分被書櫃擋住了。走廊底板下置放了幾件原始建料，特地以透明玻璃呈現，其中一片木材有斑駁的字跡，經核對後以中文寫在木板左邊。當年的木材供應來自「植裕材木店行」無誤窗明几淨非常有文藝氣息的長廊，趕快挑一本書坐下來當文青吧！每個區塊都讓人喜歡，幽幽靜靜享受閱讀的樂趣。另一個閱讀區有四張真皮座椅，都有定期做保養，坐起來非常舒服。每個角度都好美，拍照時請勿影響其他看書的人。因閱讀時間有限，只能翻閱幾本感興趣的書，重點是感受日式住宅裡的書香氣息。很居家的閱讀區雜誌區，地上三張「懶骨頭」夠舒服了！角落的風琴曾經出現在周杰倫的影片中喔！鐵窗成為壁飾，搭配復古記憶。餐飲區，在參觀結束前半個小時會開放，招待茶點。到時可一面看文房的修復紀錄影片，一面享用點心。餐飲區旁有個小小的房間，可說是一人書房，窩在裡面獨立空間，是很搶手的座位區。牆上照片：幸町日式宿舍原來的樣子，鐵皮屋頂是後來加上去的。屋前那三棵老樹，現在還蓊鬱健壯。牆上照片：宿舍修復前殘破的樣子2013年台北市政府推動「老房子文化運動」，透過與民間合作，得標團隊為頂禾開發股份有限公司，悉心修復後，讓老屋變成最美麗的公益圖書館~文房，免費開放。使用期屆滿，歷史建物返還市府，讓文化資產得以活化永續。書櫃中有利用復古工具當裝飾文房的書籍種類很多，但時間有限，真的沒辦法好好地看完一本書。茶點時間。享用茶點後，還有時間可再去看書。咖啡與紅茶擇一，附上小點心。參觀時間到，必須離開了。內部參觀過後，從後院看建築倍覺溫馨。推薦一定要找時間網路預約參觀！開放時間：週二∼週日,10:00~17:00(週一公休)","['異國','歷史']"
這個展覽其實好像也算搭上圓仔的熱潮吧除了正式展場之外，還有好幾次的快閃喔不過我人在台中，只能等正式開展之後再去見識一下正式開展是2月28日上午0900開始只是我被新聞誤導，我以為其實開展之前紙熊貓們都已經就定位了沒想到.........原來要到當天九點前才會開始擺害我一大早為了避開人群，八點就到了現場.....所以我只看到工作人員推著裝熊貓的紙箱不斷移動紙箱裡面應該就是大量的熊貓囉不過其實現場除了1600隻紙熊貓之外還有很多可以讓人就近拍攝的大型熊貓（免得有些人會批評，這個展覽只能遠觀∼別懷疑真的很多人這樣批評）趁著還沒人的時候，我們先拍拍這些大型熊貓吧可愛吧∼呵呵，不過我整理照片的時候才發現....怎麼好像光線暗暗的＝＝a除了熊貓之外∼還有台灣特有的台灣黑熊.......黑熊、貓熊來個合照這是展場的標誌喔....拍完現場之後，我是沒等到工作人員把熊貓擺出來啦（所以沒有拍擺設的時候）就先跑去看真熊貓園仔了.....只是我好像不該假日去看....真是人山人海阿（這個另一則遊記在處理）從動物園回到市民廣場.....對喔，我忘記說了這次的展覽在台北市市政府前廣場舉行，還特地封路喔1600隻的熊貓大軍，已經佔據了現場囉（雖然∼看展的人應該不只......)廢話不多說∼我們來看看佔領市民廣場馬路的貓熊大軍吧,"['展覽','親子']"
休息了好一陣子，感謝好友的關心，去年時運不佳，中年失業、車禍右手遠端橈骨骨折，復位方式癒合不全經歷一年折磨，7月到郵政醫院求診，經林偉彭醫師轉介到台大張志豪醫師，『醫生緣，主人福』，治病靠運氣、機緣，找對醫生治好病痛。手術治療後復健至今4個月，手部活動好很多了，打字上沒問題就閒不住，順利找到工作，年過半百再度進入職場，帶著感恩的心再出發。上週回診，等待看診時隨意閒逛，用手機拍下美麗的日治建築~臺大醫院舊院區。臺大醫院創建於西元1895年，院址初設於臺北市大稻埕，1898年遷至台北市常德街1號，當時為木造建築，1912年開始進行整建為文藝復興風格之熱帶式建築，於1921年完工，是當時東南亞最大型、最現代化之醫院。由於建物歷史悠久且優美，於1998年3月25日被列為台北市市定古蹟。樓高三層，以紅磚與洗石子相間砌成，入口門廊有四組希臘式柱頭，每兩根為一組，左右兩側則是三根柱，最外側柱子為方柱，使轉角顯得穩重堅固。柱頭則有雙螺旋造形、成串的葡萄裝飾，大門兩旁的窗台上面有繁複的勳章水泥飾紋，屋頂兩側有方形衛塔，中間為三角形山牆，突顯建築物雄偉的氣勢。大廳內空間高敞，氣派非凡。應景的聖誕裝飾，溫馨的氛圍讓來院病患與家屬，在等候看病的同時，放下緊張不安的心情，天井設有水池噴泉連接兩棟的廊橋使用互鎖式的鈦合金鋼板做內固定的植入物，以後不用再開刀取出。資料來源:台大醫院http://www.ntuh.gov.tw/About_Us/aboutNTUH/建築之美_西址.aspx臺大醫院創建於日治時期，昔稱臺北病院、臺灣總督府臺北醫院、臺北帝國大學醫學部附設醫院，戰後改稱為國立臺灣大學醫學院附設醫院，是臺灣近代醫學發展的核心，西址院區之建物目前做為門診及部分病房之用。本建築由近藤十郎先生設計，為文藝復興風格之紅磚鋼筋混凝土2層建物，在平面配置採取左右對稱的格局，以中央走廊貫穿，連接各門診及病房。大廳莊嚴華麗，空間寬敞，運用了許多西洋式建築技巧，是近代洋式建築的傑作，在當時是東南亞最大型及最現代化的醫院。景點資訊適合季節：四季皆宜營業時間：屬醫療場所，為維護病友權益，院區內謝絕參觀,"['歷史','異國','藝術']"
國立臺灣博物館南門園區位在南昌路上，搭捷運的話，從中正紀念堂站1號出口出來，走個三分鐘就到了國立臺灣博物館南門園區是日據時代的「臺灣總督府專賣局臺北南門工場」，創建於1899年，為製造及試驗樟腦、鴉片等兩大專賣品的重要生產基地，也是日本時代臺灣唯一的公營樟腦加工廠。1967年樟腦開放民營後，南門工場便停工廢廠，土地陸續被分割轉賣，剩下的部分在1998年被指定為國定古蹟，2006年交台灣博物館由詹益忠建築師事務所負責修復再利用之規劃設計。這棟樟腦倉庫（紅樓）由總督府技師土生瑾作設計於1914年，為一棟兩層樓之紅磚混合鋼筋混凝土構造建築，前方有單斜鐵骨造屋架之「荷造場」。其建築紅磚外牆上飾水平白色飾帶之設計風格，應是受到辰野金吾之影響，屬「辰野式」建築。橫向飾帶可強化立面的水平分割，並整合外牆窗戶與大門的楣石、窗臺、腰積上的洗石子材質。現在會有一些展覽和常設展這此展出。小白宮為臺灣少見的日據明治時代石造建築，因外觀顏色灰白，遂被稱為「白樓仔」或「小白宮」。其牆面由室外至室內分別為38cm厚之唭哩岸石與11.5cm厚的紅磚，其中唭哩岸石來自當年被拆除的舊台北城牆；唭哩岸石屬於木山層石英砂岩，是清代和日據時代常用之建築、地坪石材，產於臺北盆地之士林唭哩岸、大直、北勢湖一帶。小白宮今日做為園區內之多功能展示空間，並有修復歷程展示園區的行政大樓一樓的南門童話區，這裡的展覽是藉由繪本故事、遊戲互動、3D藝術及感官體驗的多元互動方式，提供孩童認識南門園區動、植物生態的親子空間，但是要事先預約。跟入口處的裝置藝術拍照，這是台灣知名雕塑家楊英風的作品「梅花鹿」小白宮北側戶外區有三顆老樟樹，樹齡應該有80年了吧！戶外區的綠地中間的水池稱為「四百石貯水槽」，是當年放製造過程產生的廢水的地方，平常做灑掃灌溉之用，發生火災時就當作消防用水這裡還有台車啦~~呵呵，沿著鐵軌前進，逛完室內，再逛戶外景觀區，感覺還不賴只是覺得這麼棒的地方，怎麼人那麼少...真是撿到便宜了..這區不是台北的鬧區，就算假日來也不會人擠人，有古蹟和戶外綠地可欣賞跟吸收不同知識，很適合帶小朋友來玩喔~,"['公園','歷史','親子','藝術']"
具有悠久歷史的南門市場，於去年起花費一年耗資1.1億元重新進行打造，在101年11月17日重新開幕。市場外觀看起來似乎沒有什麼改變，只是一旁多了橘色的南門市場招牌，這應該是新架設上去的。媒體報導本次改裝的重點在於地下1樓跟2樓，將天花板管線等進行整修。門前柱子上貼滿了各樓層的簡介說明1樓主要是販售南北貨、肉乾及各式熟食類食品，各家攤販位置跟印象中相同，應該是沒有變。一進門就見到串串色澤美麗的臘肉極有名氣的肉乾舖地下一樓主要是傳統市場，販賣各式生鮮。在南門市場改裝前，我沒有下來過地下一樓，每次都只是到一樓買年貨。這次因為改裝，特地下來看看。完全顛覆我對傳統市場的印象，我愛吃，但是卻從小就討厭陪婆婆媽媽到傳統市場去。因為娘家附近的傳統市場地面總是凹凸不平，地上的窟窿充滿了魚販留下的臭水，一小心就會被濺到，很是噁心。改裝後的南門市場地下一樓，光線明亮，地面平坦乾爽，難怪會被稱為是五星級的菜市場。販賣火鍋餃的店鋪，冰箱中放滿各式的餃類及火鍋料一旁還可見到店員手工現做火鍋餃呢販售蔬菜水果的店家，相信食材應該都很新鮮，看起來都好漂亮還有特殊造型的南瓜，上面有各種不同的吉祥話呢!這間肉舖除了採用市場統一的招牌外，還掛上了一整顆的牛頭標本，令人十分印象深刻。二樓則是服飾店以及美食街隔成一間間的服飾店，中間走道寬敞，還放上了不少的木頭座椅，走累了可以坐著休息。除了服飾外，也有販賣小女生們都會喜歡的日本商品用餐時間二樓美食廣場擠滿了用餐的人潮，根本就像是百貨公司美食街嘛!改建後的南門市場不只是環境五星級，連洗手間都是五星級。,"['異國','歷史']"
在台北建城前兩年，台北府淡水縣有位家財萬貫的貢生洪騰雲，因捐獻城內的田地及銀兩，並興建考棚，台灣巡撫劉銘傳為褒揚洪騰雲，於清光緒十三年(西元一八八七年)奏請建坊以示獎勵。清光緒十四年(西元一八八八年)，坊成於台北城西門內的市街，街道還因此稱為「石坊街」(今衡陽路)。在日治時，因石坊佇立於街道中央而妨礙交通，而遷建於現228紀念公園內迄今。急公好義石坊為四柱三間式，形式完整，雕工精緻，而坊前的兩對一大一小獅子，小的石獅為牌坊原物古拙而可愛，大的石獅原為台北府衙之物，雕工細膩、造型威武，這也是清代台北府衙唯一保存的歷史見證；牌坊雖經拆建，但仍相當完整，美中不足的是當年的聖旨石牌已不知去向，徒留碑座在牌坊上；若爾後有機會前往228紀念公園參觀時，可別忘了欣賞此座清代石坊喔!,"['捷運','園區','夜市']"
台灣也有迷你版埃及金字塔，狹小的樓梯堆砌而成金字塔，IG打卡場景吸引許多網友前往拍照，假日休閒適合假日好天氣時前來朝聖。位在新北林口也有金字塔打卡景點，過去曾經是一座森林遊樂園，在歇業後改名為珍珠嶺人文廚房，目前剩下金字塔與餐廳兩個區域。進入到珍珠嶺人文廚房需低消費100$，營業時間為11:00 - 20:00 (週二未營業)基本上景觀餐廳大致上消費差不多，下午茶來逛逛休息一下也不賴。來珍珠嶺最吸引人的就是後方的金字塔奇觀，吸引許多網友前往朝聖。不時還能見到園區家貓在這裡慵懶躺著~也太悠哉!狹小的樓梯所堆砌而成金字塔奇觀，不管從哪個位置都好拍。而且也可以站上頂端來拍照，不過安全問題需要自行負責喔。站在塔頂還能遠眺旁邊的高爾夫球場，雖然珍珠嶺人文廚房範圍不大，但台灣有這樣的場景印象中很少，算是挺新奇的~十分適合假日好天氣時前來走走。林口珍珠嶺人文廚房地址：新北市林口區下福里15號營業時間：11:00 - 20:00 (週二公休)每人低消＄100<地圖點選...>,"['公園','藝術','展覽']"
