象山位於臺北市信義區，與獅山、虎山、豹山合稱四獸山。站在象山上，遠視臺北盆地，近觀101大樓，可謂臺北之大觀。自臺北捷運信義線〈紅線〉象山站一腳踏出。途經中強公園。自象山站前往象山，有兩個登山口。阿文選擇靈雲宮登山口，隨興而已。象山的步道，包括各具特色的北星寶宮步道、永春崗步道與一線天步道。各步道彼此連結，一路行來，輕鬆愉快。北星寶宮步道長約825公尺，登山口在靈雲宮側邊。自登山口進入，一路陡升。即便一路陡升，只要緩慢前進，調勻呼吸，行來並不困難。登上象山石碑，便是知名的六巨石。遠眺近望六巨石，觀賞拍照兩相宜。登象山小天下。【攝影平臺】攝影平臺觀紅塵，繁榮商圈入眼簾。圓山飯店櫛比樓，齊奔鏡頭永恆畫。鶴立雞群新光廈，爭高直指天際線。七星山、大屯山處在虛無縹緲間。樹林開闊處，偶得信義美框景。巨大岩石是北星寶宮步道最大特色。岔入永春崗步道，長約850公尺。位於稜線平臺上的超然亭，擁有無敵的視野。此處是夜間觀賞國慶日施放花火最佳位置。大臺北奔來眼底，信義圈銘刻心坎。沿路下切，來到觀景平臺。鳥瞰已經陸化的永春陂，是永春崗步道的亮點。【右側】【左側】虎豹獅象同矗立，捍衛古早永春陂。嵐影波光永春陂，清末達官追憶時。昔日埤塘今成市，滄海桑田活化石。【打印臺】到此健行，綠林為證。永春高中附近的永春崗公園，是永春崗步道的出口，也是象山第三個登山口。象山我獨行，101如影隨形。自永春崗公園折返，遇佛語石直行一線天。一線天步道長約820公尺，茂林中設有永春亭。近望信義商圈更貼近了！步道潮溼，蕨類繁多，是一線天步道給人的印象。經過僅容一人通行的一線天。仰首觀賞令人嘆為觀止的彩繪大石壁，不虛此行矣！象山因外形似象頭而得名，位於臺北盆地東南方的信義區，與虎山地質相同主要由砂岩組成，因造山作用步道中可見黃褐色陡峭的岩壁與巨石，加上自然環境生物、鳥類種類繁多，使得整座山如同一座天然生態樂園般，成為民眾接近淺山、享受戶外綠林悠閒時光的好去處。步道沿線設有解說牌引導民眾參訪，區內各種稜線、岩壁、山坡等不同環境，孕育出多種蕨類植物處處可見，其中又以金狗毛蕨與筆筒樹古老蕨類族群最大，數量居臺北市之冠。在過去醫學普遍不發達的年代，金狗毛是民間常用來止血的最佳良藥，而筆筒樹群林則是臺北市最珍貴的的生態特色。登頂象山眺望，臺北盆地的地景幾乎一覽無遺，其尾稜延伸嵌入信義區中強公園，成為當地居民晨昏散步的最佳去處，也是近山民眾假日休閒、舒緩身心的綠色地帶。六巨石象山上巨石林立的奇特景象，又稱老萊峽。從這裡攀上巨石可以一覽繁華的信義商圈，是一處熱門的拍照景點，清晨上山可以欣賞臺北101大樓在晨曦中初醒的景象，黃昏更可欣賞信義區都會華廈，夕陽餘暉西下、華燈初上的夜晚景象，十分亮麗耀眼。象山看台北夜景真的很棒，從傍晚到夜晚尤其日夜交替的色溫，真的很美到了夜晚，燈火通門的街道搭配上101，真的美翻了要看那麼美的夜景，要先爬一段的登山步道即可到達六巨石，便可俯看這便美景逸賢亭（象山頂）位於逸賢亭象山頂、六角亭旁步道盡頭的平台，視野展望極佳，可以欣賞象山的全貌，尤其是象頭與象鼻頗具傳神。鼻樑處即為永春高中，長長的象鼻子則是稜線深入松山路與松德院區之間的平台。一線天象山親山步道近松德院區方向有處名為一線天駐腳點，因兩壁山脊線十分接近，巨崖岩壁突出遮天，山友自步道仰頭望天，只見崖壁縫隙間的天空又窄又細，因而稱為一線天。登高遠眺繁華台北盡收眼底四獸山是距離台北市松山、信義區最近的山頭。象山位在四獸山步道系統中最高點，由於前方無屏障，登高遠望視野遼闊，不僅信義商圈一覽無遺－101金融大樓、世貿中心、華納威秀、新光三越等醒目建築歷歷可數，台北盆地風光也盡收眼底。自然生態精采可期象山範圍不大，賞景點卻不少。其中盤踞山頭的「六巨石」是象山的地標景觀，巨石林立、景觀奇特，遊象山不攀上巨石瞧瞧，可就對不起自己了。在頂上觀景滋味不同，迎風四望無際，想拍101，來這裡準沒錯！至於鳥瞰台北盆地的最佳位置，自然是位於稜線上、視野開闊的「超然亭」；有此「超然」名號，便是因為由此觀景居象山眾涼亭之冠。站立於超然亭的平台上，近可見山下的信義計畫區，放遠望去則是圓山、北投焚化爐、觀音山及大屯火山群各景點，從前國慶日施放煙火，不少人還會特地來此觀賞花火綻放，足見其魅力所在。繞行到巨石公園階梯附近，有一塊碩大的巨石，上面有人為雕刻出來的石階，可拾級而上眺望台北盆地。一路前行間，由左側山腰、山脊再下到右側山腰線，從不同角度俯瞰台北盆地之美，象山迷人之處盡在其中。自然生態精采可期巨石公園步道沿途都設有解說牌，引導親山訪客認識整個山頭的特色，所以這裡也是最受歡迎的自然教室。一路上不愁沒有生態導覽，只要「按圖索驥」，自己就是山林解說員。象山擁有稜線、岩壁、山坡、山窪、山谷等各種不同微環境，因而孕育出70多種蕨類。蕨類在象山處處可見，有的附著在樹幹上，有的長在岩石、坡地上，有的密佈在潮濕的林下。其中金狗毛蕨族群龐大，數量居臺北市之冠，在過去醫藥不發達的年代，它可是民間用來止血的最佳良藥。另外在開闊、向陽且潮濕山窪區，還有自侏儸紀時期就存在的古老蕨類「筆筒樹」。筆筒樹群聚可是台北市區最珍貴的生態特色，因為筆筒樹成群林立的現象，全世界只有台灣北部才能看得到。潮濕的環境中，蝸牛的族群也十分可觀，像是斯文豪氏大蝸牛、煙管蝸牛，幾乎在整個山區都看得到。這本是低海拔的原始闊葉林，生態豐富多元，綠意萬千的山林，還有更多的驚喜等待你自己慢慢去發掘呢！健身舒活親子休閒樂趣多象山入口意象雖說象山只有海拔181公尺，對於喜歡「超越顛峰」的人，顯然挑戰度不高。登上象山之後，如果你的體力充沛，或是想伸展筋骨，步道兩旁還有許多強體力及肺活量的體能設施，只見大夥在山頂的逸賢亭打個尖、做個操，還有精力無窮的小朋友穿梭其間，運動休閒一兼二顧，很適合全家來活動。地理位置象山位於台北市信義區，屬於台北盆地東南丘陵的一部分，因山形似象山而得名；與附近的虎、豹、獅山並稱四獸山，同為南港山系的側稜延伸。海拔標高183公尺，山雖不高，但前無屏障，台北盆地一覽無遺，是登高眺望的好據點。人文歷史象山所屬的四獸山昔日屬松山區，其人文特色與松山的發展有著密不可分的關係。松山舊稱錫口，早期是平埔族的「貓里錫口社」，清乾隆十年（西元1745年）漢人來此開墾，漸漸形成一個大城鎮。並因鄰近基隆河而成為重要的港口，曾經商賈雲集鼎盛一時。後因河道淤積，加上台北、基隆間鐵道通行，使錫口逐漸沒落。日據時代，日人將錫口改名「松山」，沿用至今。生態現況象山是台北東區一座完整的山稜，坐東朝西，內有稜線、岩壁、山坡、山窪、山谷等微環境的分化。象山自然步道則是選擇沿著象山西側山腰及山稜，環繞成一完整的循環路線，涵蓋沿線多樣之自然生態景觀。山稜環境屬巨岩地形，植物相多為低海拔、岩石地的向陽性植物，如：黃杞、青剛櫟、大明橘、大頭茶….等。西側山腰以山窪環境為主，是一遮陽多濕的區域，筆筒樹、菲律賓榕是代表性的優勢植物；此外以金狗毛蕨為主的大岩壁亦是西側步道的主要景觀，岩生植物眾多。從靈雲宮進入步道不久，有一段山谷環境，該區山黃麻成林，林下則密生海南實蕨，頗具特色。整體而言，象山曾為相思樹造林地，所幸經過相當時間的保護，又因台北地區植物發展潛力旺盛，才讓這片森林重獲生機。迄今，象山的大部分地區已由自然萌發演替中的天然林，逐漸取代人工相思林。如何到達象山入口一：永春高中(永春崗公園入口)【公車】◆永春高中站／27、46、259、299、504、33、信義幹線（市公車）◆松山商職站／258、忠孝幹線、信義幹線（大有）、263【捷運】●淡水或中和線《火車站》→公保大樓搭乘信義幹線、或希爾頓前搭乘259、299、忠孝幹線●木柵線《大安站》→搭乘信義幹線●《忠孝復興站》→搭乘259、299、504、忠孝幹線入口二：吳興國小(靈雲宮入口)【公車】◆吳興國小站／1、22、32、37、38、226、288、503、33【捷運】●淡水或中和線《火車站》→公保大樓或省立博物館搭上述公車●木柵線《大安站》→搭乘上述公車↓下圖：象山步道週遭交通及步道路線圖[點圖片觀看大圖]景點資訊適合季節：四季皆宜旅遊日期:96.11.16氣狀況:晴天象山自然步道是四獸山步道一環、信義區裡有象山、獅山、虎山及豹山合稱四獸山。如由象山往上走往姆指山稜線過九五峰可縱走至南港中華技術學院，而尚有南港山及南港大崖壁，附近步道可說錯綜複雜非一天可走完。從南港至象山的步道此次我已來走第三趟，但尚未將此地所有路線走完。四獸山附近步道指標上還清楚可說路路相通又屬近郊步道，平日已是很多人踏青爬山遇到假日更是人聲鼎沸、人馬雜沓非常熱鬧。由於路路相連接通路程遠近可按個人腳力不同而做不同的適度調整，是北市地區最佳的休憩遊玩勝地。象山自然步道登山口有三處:永春高中、市立療養院及吳興國小靈雲宮附近。我選擇自永春高中後面的永春崗公園進入，永春崗公園不大座落於永春高中側後方山坡上，循公園正面石階而上左轉即可找到象山自然步道，或在石階中途左邊有一條石塊路也通登山口，公園內竹叢花木遮蔭環境寧靜是附近一帶最好的休憩場所，往竹叢方向即可接上象山自然步道。象山自然步道是北市信義區四獸山自然步道的一環，四獸山有象山，獅山，虎山、豹山加上附近錯綜複雜的步道，一天內要走完附近的步道有困難。象山自然步道第一個叉路口，直上往上面打印台而左轉是腰繞路往一線天、彩繪大岩壁及六巨石。先往右行。步道通過岩石夾縫，岩石夾縫稱為「一線天」。大片的裸漏岩石，岩壁上呈現不同的深淺色澤故稱「彩繪大岩壁」。過彩繪大岩壁步道叉路往上而走上至稜線口，此處矗立六個巨岩在稜線上，石壁上有「老峽」兩字，不知何意？但此處視野良好展望不錯，台北101大樓由山下市區挺拔而起與山爭高。循步道往上而行又過一大岩石，大石上書有「象山崗」三字，我想上頭應是象山了吧！象山上觀看台北101大樓，站在此地看101有種登高山而小大樓之感。象山頂高183m山頂有一木造涼亭，找不任何基石但樹上釘有象山高度標示牌。過象山有叉路，右邊往拇指山上九五峰稜線左邊步道往打印台可回永春崗公園，如體力過可再上九五峰稜線到南港中華技術學院，或左轉一小圈回到永春崗公園，但我想先左轉再下天寶宮往虎山峰去。石階步道走累了，來段森林泥土小路倍感舒服。天寶宮後山有一「至聖先師」孔子塑像，此地似乎較少人來略顯荒涼。天寶宮座落在巨石園附近，左邊是一大片石壁有小路通往，石壁下塑有各種佛像但似乎少有人進入，步道上草已掩徑。但右邊的巨石園則是不同光景，巨石園內有無極天王廟、山神廟、大形壁洞神像及石壁神像。巨石園內的石砌小廟「山神洞」周圍盡是大石圍繞。往上有間廟內正位牆上書有「天王令」的小廟，廟前兩根龍柱矗立。鑿石壁塑建的大型神像「無極天王」神像下廣場有人在進行法事。大岩壁下的「觀音后土」神像，石壁上雕有佛語：一切有為法、如夢幻泡影，如露亦如電、應作如是觀。天寶宮左邊沿石壁下小路進入，石壁下塑有不少此類佛像，但似乎少有人進略顯荒涼。再由天寶宮左後方步道上去，經過一處菜園小徑尋找往虎山峰的松山路產道。小路往上而行後接松山路產道左轉而行經過靈隱寺及瑤池宮後在左手邊有石階步道往虎山峰。通往虎山峰的步道兩旁路樹林立，清風徐徐風景極美。虎山峰上俯瞰前面虎山120高地，高地上有一木造涼亭。虎山峰163m山頂上有一觀景台，水泥柱上是一日晷儀。虎山峰頂展望相當良好可眺望象山、獅山及九五峰稜線。下虎山峰走往虎山120高地的稜線步道。虎山120高地上觀看裸露凸出的大裸岩，為信天宮步道上第二出裸岩，裸岩上方有人在禪坐。走往第二裸岩處，古樸的石階及漂亮的行樹，一路而下風景視野皆是不錯。另一角度觀看第二裸岩處。觀看第一及第二裸岩，後方是虎山120高地上的涼亭。接近信天宮步道上龍山洞上面的大片岩石，岩石上不滿年輕男女的愛情誓言塗鴉。岩片下的龍山洞是一練歌坊而另一頭是龍山宮，此洞又稱「日本洞」不知何故？步道口的奉天宮，出奉天宮後接上松山福德街。行走路線:松山火車站09:05→永春崗公園09:39→一線天09:53→彩繪大石壁09:56→六巨石10:08→象山頂10:20→天寶宮11:05→巨石園11:15→岩壁佛像11:55→虎山峰12:46→虎山120高地12:52→第二裸岩13:04→日本洞13:21→奉天宮13:30→松山火車站14:10※交通:1.永春崗公園：交通可搭聯營33、299、信義幹線等公車在『永春高中站』下車，或搭33、46、207、257、263、277、299、651、藍10、博愛等公車在『松山商職站』下車，再步行前往永春崗公園右側石階進入。2.市立療養院：交通可搭聯營20、37、46、277、612、博愛等公車在『松德站』下車，至市立療養院右側石階進入。3.靈雲宮：交通可搭聯營1、22、32、33、37、38、226、266、288、665、藍5等公車，在『吳興國小站』下車，再由信義路150巷22弄進入，從靈雲宮旁，見有『象山早覺會』字樣的拱形鐵架，沿水泥階而上。到松山彩虹橋河濱賞花海景觀後，返回松山車站，看看時間還早，決定就近爬爬象山步道，於是沿著松山路直走，轉信義路6段，再從76巷8弄進入，經過顏子廟之後有一福德宮，自登山口進入後從廟後石階一路上爬，約5-6分鐘就到了永春崗公園。從顏子廟登山口至永春崗公園這段階梯步道，也有稱為顏子廟步道，公園內花木扶疏，景色優美，也有許多市民上來活動。經過永春崗公園續直行上爬，轉為寬大花崗石階梯，穿梭於綠蔭下，約6分鐘到達永春崗平台，此處也是象山環狀步道的叉路口，若直行上爬是往六巨石，取右從佛謁石壁旁步道過來，往一線天步道。一線天步道沿著山坡腰繞小有起伏，從叉路口過來，不到3分鐘即鑽過「一線天」巨岩狹縫，其最窄處的寬幅僅容一人側身通過。象山環狀步道是結合象山一線天、北星寶宮及永春崗3條步道而成的O形環狀路線，於一線天步道途中遇叉路，直行可下信義路5段，取左階梯步道上爬，是通往六巨石的捷徑。六巨石位於北星寶宮步道途中，今日人滿為患，人聲鼎沸，不待久留，續取左上爬，經象山崗往相機平台。今天是2016年最後1天，爬上象山最高點，涼亭內外到處都是人，也是門庭若市，其中不乏許多角架大砲卡位，依相機方向，目標物應是台北101，原來是愛好拍照攝影人士，為了跨年煙火秀提前卡位的，來晚的可就沒有最佳的拍攝點了。距跨年煙火秀上演時間還有12小時以上，象山之頂已是愛好拍照攝影人士的兵家必爭之地，卡位戰提前上場，由此可見一斑，人們只要是興趣嗜好之事，作起來總是格外熱衷，樂此不疲呀，我續前行經打印亭，然後一路下坡，從環狀步道的左路下來，完成環狀步道O形一圈之後，續走原路下抵永春崗公園，轉從永春崗登山口出來，然後沿松山路步行至松山車站，結束今日行程。105.12.31,"['公園','自然','夜景','景觀','捷運','步道']"
坐落在台北市繁華的東區之內，不對外開放的《松山菸廠》成為塵囂熱鬧中一處獨特的安靜場景，也因此，被有「異次元偶像劇」之稱的《米迦勒之舞》看中，成為拍攝場景之一。「米迦勒」三字源於希伯來文，意指「守護天使」，劇中主角小龍的命運被一場車禍改變，Hero的靈魂藉由小龍重現，而小龍必須執行Hero生前重要的使命──練成對抗邪惡之神的米迦勒之舞！因此，「舞」的元素在劇中相形重要，而劇中數場打球跳舞的場景，即是在此拍攝。佔地20甲的菸廠，打從日據時代保存至今，植有樟樹、黑板樹、大葉山欖、楓香、榕樹等，仿若窩藏都市的小型森林，1998年菸廠停止運作後，區內的辦公廳舍、一號及二至五號倉庫、鍋爐房等，在2001年5月被台北市政府指定為市定古蹟，加上少人造訪，區內的水塘有夜鷺、翠鳥、紅冠水雞棲息，池內鯽魚、鯉魚閒遊，已自成一生態區。,"['自然','景觀']"
140高地公園曾出現在新聞畫面，當時就很好奇在哪堙A於是抽空過來看看，發覺這裡視野真好，然後看看觀景台的說明，讓人有點小小的驕傲，因為視野所及的山巒，大部分都曾經走過，關於愛台灣這個話題，我想我算蠻用心的。140高地公園，從地圖上看來，應該就是抱仔腳山，曾搜尋過相關資料，並無有關抱仔腳山的敘述，所以就當它是抱仔腳山。這裡交通方便，棕6路有到，走起來輕鬆，不用半小時就可上下一趟。營業時間：全年無休,"['公園','景觀','自然']"
尾崙山(又稱美崙山)，海拔359公尺，有土地調查局圖根點基石隱身林間，因四周林木遮掩無展望。取原路再回狗殷勤水圳步道，望見山谷之間菜園、梯田，有花崗石階步道叉路左下，可截彎取直先下後上至對面接水圳路，但因少有人走已顯荒蕪，不取。續直行水圳路，腰繞山谷經過絲瓜棚架，這段水圳旁步道已施作水泥，路右下方有叉路來會，應該就是剛才左下截彎取直的路線。重遊去年走過的路線，雖然今天是反方向走來，熟悉的感覺依舊，水圳路出來，直行永公路40巷寬大水泥路下坡。大樹公叉路下來，取右續行，至小17「指福宮」公車站牌，從菜園小巷進入，依指標往故宮博物院方向。莊頂路80巷直行，經過台北復臨美國學校，取左，穿過高級別墅區柏油路下來，有玄明宮登山休息站，廟前有一座小型四面佛相，歡迎參拜。休息站下坡一小段，路右竹仔園有叉路，拾階陡下，指標往故宮博物院。這段石階，充滿古味，十分斑駁、陡峭而古樸，看起來除了登山客應是鮮少人走，如果不是光天化日，朗朗乾坤，氣氛可是有點駭人的。很快的從竹林階梯下來，擺脫一股不安的感覺，途中有福德廟，休息一下，再從民宅菜園中小路出來。取右，經擇善居門前過，擇善居是一座傳統的紅色磚瓦厝三合院，目前還有人生活居住。通過臨福橋，潺潺溪水小瀑水花四濺，感覺清涼許多。原住民文化主題公園區內茵茵草皮，花木扶疏，公設齊全。夏日炎炎何處去，喜歡爬山的人，當然要配合四時花草、不同的季節，選擇適合的路線，方能真正體會登山之樂也。去年走尾崙水圳步道，從故宮這頭爬上平菁街42巷，今天是反方向下來，相同的路線，走起來有截然不同體驗，想要挑戰爬山，或輕鬆下山，任君選擇。原住民文化主題公園內茵茵綠草，六月鳳凰花開，蟬聲嘶鳴，白鷺鷥輕盈地飛翔在水池與草地上。102.6.22天氣：晴朗炎熱,"['步道','公園','自然','秘境']"
